{
  "contract": "transformer-flight",
  "version": 9,
  "requestId": "abababab-abab-4aba-8aba-abababababab",
  "modelRef": "mdl_01j2x5f4x6h7k8m9n0p1q2r3s4",
  "label": "returns.daily",
  "generation": 1,
  "dataContract": {
    "id": "inventory.learning-dataset",
    "version": 2,
    "profile": "research-dividend-events-v2",
    "dataContractSha256": "aaaaaaaaaaaaaaaaaaaaaaaaaaaaaaaaaaaaaaaaaaaaaaaaaaaaaaaaaaaaaaaa",
    "seqLen": 2,
    "featureDim": 2,
    "targetSchemaId": "inventory.target.v2"
  },
  "mlContract": {
    "targetSchemaId": "inventory.target.v2",
    "predictionSchemaId": "transformer.prediction.target-aligned.v3",
    "objectiveId": "transformer.objective.declarative.v1",
    "objectiveConfigSha256": "ffd75380fa9a303f44a38205bd32ae8f63350782f4d306e32796190f955de115",
    "checkpointFormat": "transformer-checkpoint-v5",
    "targets": [
      "MeanReturn",
      "SigmaReturn",
      "ProbTP",
      "ProbSL",
      "VolatilityNext",
      "HittingProbTP"
    ],
    "targetWidth": 6,
    "predictionSpace": "target",
    "objective": {
      "schemaVersion": 1,
      "aggregation": "WeightedSum",
      "reduction": "GlobalRowMean",
      "directLosses": [
        {
          "target": "MeanReturn",
          "operator": "SmoothL1",
          "weight": 1.0
        },
        {
          "target": "SigmaReturn",
          "operator": "SmoothL1",
          "weight": 1.0
        },
        {
          "target": "ProbTP",
          "operator": "BinaryCrossEntropyWithLogits",
          "weight": 1.0
        },
        {
          "target": "ProbSL",
          "operator": "BinaryCrossEntropyWithLogits",
          "weight": 1.0
        },
        {
          "target": "VolatilityNext",
          "operator": "LogMSE",
          "weight": 1.0
        },
        {
          "target": "HittingProbTP",
          "operator": "BinaryCrossEntropyWithLogits",
          "weight": 1.0
        }
      ],
      "auxiliaryLosses": [
        {
          "operator": "GaussianNLL",
          "weight": 1.0
        },
        {
          "operator": "RiskAdjustedExpectedValue",
          "weight": 0.3,
          "riskPenalty": 0.1
        }
      ],
      "balancing": {
        "operator": "Static"
      }
    }
  },
  "modelConfig": {
    "seqLen": 2,
    "hidden": 256,
    "layers": 5,
    "dropout": 0.1,
    "nhead": 8,
    "mode": "relaxed",
    "outDim": 6,
    "featureDim": 2
  },
  "initialization": {
    "kind": "publishedModel",
    "parentModelRef": "mdl_parent",
    "parentCheckpointSha256": "eeeeeeeeeeeeeeeeeeeeeeeeeeeeeeeeeeeeeeeeeeeeeeeeeeeeeeeeeeeeeeee",
    "parentDataContractSha256": "4444444444444444444444444444444444444444444444444444444444444444",
    "dataContractSha256": "aaaaaaaaaaaaaaaaaaaaaaaaaaaaaaaaaaaaaaaaaaaaaaaaaaaaaaaaaaaaaaaa"
  },
  "checkpoint": {
    "format": "transformer-checkpoint-v5",
    "sha256": "dddddddddddddddddddddddddddddddddddddddddddddddddddddddddddddddd",
    "bytes": 123456
  },
  "createdAt": "2026-08-10T12:05:00Z"
}
